Title,Short explain,Subtitle,Seconed button,Seconed button - Text,Seconed button 2,Seconed button 2 - Text,Seconed explain,Seconed picture,Third subtitle,Third button,Third button - Text,Third explain,Third picture,Four Subtitle,Four  button,Four  button - Text,Four  button 2,Four  button - Text,Four  explain,Four  picture,Fifth subtitle,Fifth button,Fifth button - Text,Fifth button 2,Fifth button 2 - Text,Fifth explain,Fifth picture,Six subtitle,Six button,Six button - Text,Six button 2,Six button 2- Text,Six explain,Six picture,HMO,serial number,Category,Sub-category,Notes,Rank 
אמבולנס,מכבי מכסה את עלות הפינוי במלואה למאושפזים.,אופן מימוש ההחזר,https://www.maccabi4u.co.il/31276/digital-services/administration/refund_request/#showData_134543,בקשת החזר כספי,,," כדי לממש את ההחזר, יש להגיש למכבי את חשבונית האמבולנס המקורית, וסיכום האשפוז או ביקור במיון. ההגשה מתבצעת דרך האתר, האפליקציה או סניף מכבי.
להגשה באתר מכבי – החזרים אישורים והתחייבויות -> בקשה להחזר כספי -> הסעות ונסיעות -> פינויים באמבולנס -> צירוף מסמכים (קבלה וחשבונית מס מקורית + מסמכים רפואיים) ושליחת הבקשה
",,דגשים חשובים,,,"
 שמרו את חשבונית האמבולנס המקורית - מכבי דורשת מקור בלבד, לא צילום.
אם הפינוי בוצע דרך מד""א – אפשר לבקש מהם עותק מקורי במקרה של אובדן.
בקשו סיכום ביקור מהמיון - גם אם לא היה אשפוז, סיכום רפואי יכול לעזור להוכיח שמדובר במקרה חירום.
הגישו מהר - כדאי להגיש את הבקשה תוך 90 ימים מהאירוע.

",,,,,,,,,,,,,,,,,,,,,,,מכבי,"InfoCard_Rights_113
",Rights,,,
אמבולנס,"כללית מכסה את עלות הפינוי במלואה למאושפזים, ותשלם אוטומטית למד״א או לספק האמבולנס.",התנהלות במקרה של קבלת דרישת תשלום,https://mushlam.clalit.co.il/he/Pages/privateclaimsnew.aspx,הגשת בקשת החזר מכללית,,,"
ככל אין צורך להגיש בקשת החזר, אלא אם קיבלתם דרישת תשלום בטעות או שילמתם בעצמכם לפני שהובהר שמדובר במקרה מזכה.
מסמכים נדרשים לטובת קבלת החזר במקרים אלו
סיכום אשפוז או אישור מהקבלה בבית החולים.
דרישת התשלום שקיבלתם ממד""א (אם רלוונטי).
חשבונית מס קבלה מקורית אם כבר שילמתם.
דוח מיון ודוח אמבולנס (ניתן לבקש מבית החולים וממד״א)
",,דגשים חשובים,,,"
לא לשלם לפני בירור – אם היה אשפוז, כללית אמורה לשלם למד״א.
 שמרו את החשבונית המקורית אם שילמתם – היא דרושה להחזר.
שמרו אצלכם עותק של כל מסמך.
הגישו תוך 90 ימים מהאירוע – כדי לשמור על הזכאות.

",,,,,,,,,,,,,,,,,,,,,,,כללית,"InfoCard_Rights_114
",Rights,,,
אמבולנס,"הקופה מכסה את עלות הפינוי במלואה למאושפזים. כדי לממש את ההחזר, יש להגיש את חשבונית האמבולנס המקורית, וסיכום האשפוז או ביקור במיון באתר הקופה, האפליקציה או הסניף הקרוב לביתכם.",טיפים ודגשים חשובים,https://www.meuhedet.co.il/%D7%9E%D7%90%D7%95%D7%97%D7%93%D7%AA-%D7%90%D7%95%D7%A0%D7%9C%D7%99%D7%99%D7%9F-%D7%90%D7%AA%D7%A8-%D7%95%D7%90%D7%A4%D7%9C%D7%99%D7%A7%D7%A6%D7%99%D7%94/%D7%9E%D7%90%D7%95%D7%97%D7%93%D7%AA-%D7%90%D7%95%D7%A0%D7%9C%D7%99%D7%99%D7%9F/%D7%91%D7%A7%D7%A9%D7%94-%D7%94%D7%97%D7%96%D7%A8%D7%99%D7%9D-%D7%91%D7%90%D7%95%D7%A0%D7%9C%D7%99%D7%99%D7%9F/,הגשת בקשת החזר ממאוחדת,https://www.leumit.co.il/heb/remotemedicalservices/onlineservices/refund/,הגשת בקשת החזר מלאומית,"
שמרו את חשבונית האמבולנס המקורית - מכבי דורשת מקור בלבד, לא צילום.
אם הפינוי בוצע דרך מד""א – אפשר לבקש מהם עותק מקורי במקרה של אובדן.
 בקשו סיכום ביקור מהמיון - גם אם לא היה אשפוז, סיכום רפואי יכול לעזור להוכיח שמדובר במקרה חירום.
הגישו מהר - כדאי להגיש את הבקשה תוך 90 ימים מהאירוע.

",,,,,,,,,,,,,,,,,,,,,,,,,,,,כל הקופות,"InfoCard_Rights_115
",Rights,,,
